<?xml version="1.0"?>

<!--<!DOCTYPE xmimsim SYSTEM "http://www.xmi.UGent.be/xml/xmimsim-1.0.dtd"> -->
<!DOCTYPE xmimsim SYSTEM "/Volumes/Home/schoon/github/xmimsim/xml/xmimsim-1.0.dtd">

<xmimsim>
	<general version="1.0">
		<outputfile>test_output.txt</outputfile>
		<n_photons_interval>100000</n_photons_interval>
		<n_photons_line>10000</n_photons_line>
		<n_interactions_trajectory>4</n_interactions_trajectory>
	</general>
	<composition>
		<layer>
			<element>
				<atomic_number>7</atomic_number>
				<weight_fraction>75.55780</weight_fraction>
			</element>
			<element>
				<atomic_number>8</atomic_number>
				<weight_fraction>23.16160</weight_fraction>
			</element>
			<element>
				<atomic_number>18</atomic_number>
				<weight_fraction>0.96000</weight_fraction>
			</element>
			<density>1.22E-3</density>
			<thickness>3.0</thickness>
		</layer>
		<layer>
			<element>
				<atomic_number>14</atomic_number>
				<weight_fraction>46.73924</weight_fraction>
			</element>
			<element>
				<atomic_number>8</atomic_number>
				<weight_fraction>53.26076</weight_fraction>
			</element>
			<element>
				<atomic_number>20</atomic_number>
				<weight_fraction>60.0E-4</weight_fraction>
			</element>
			<element>
				<atomic_number>22</atomic_number>
				<weight_fraction>100.0E-4</weight_fraction>
			</element>
			<element>
				<atomic_number>24</atomic_number>
				<weight_fraction>80.0E-4</weight_fraction>
			</element>
			<element>
				<atomic_number>26</atomic_number>
				<weight_fraction>150.0E-4</weight_fraction>
			</element>
			<density>2.65</density>
			<thickness>0.2</thickness>
		</layer>
		<layer>
			<element>
				<atomic_number>7</atomic_number>
				<weight_fraction>75.55780</weight_fraction>
			</element>
			<element>
				<atomic_number>8</atomic_number>
				<weight_fraction>23.16160</weight_fraction>
			</element>
			<element>
				<atomic_number>18</atomic_number>
				<weight_fraction>0.96000</weight_fraction>
			</element>
			<density>1.22E-3</density>
			<thickness>3.0</thickness>
		</layer>
	</composition>
	<geometry>
		<d_sample_source>1000.0</d_sample_source>
		<n_sample_orientation>
			<x>0.0</x>
			<y>0.707107</y>
			<z>0.707107</z>
		</n_sample_orientation>
		<p_detector_window>
			<x>0.0</x>
			<y>-1.0</y>
			<z>1000.0</z>
		</p_detector_window>
		<n_detector_orientation>
			<x>0.0</x>
			<y>1.0</y>
			<z>0.0</z>
		</n_detector_orientation>
		<area_detector>0.30</area_detector>
		<acceptance_detector>1.57</acceptance_detector>
		<source_size>
			<sigma_x>0.0</sigma_x>
			<sigma_xp>0.0</sigma_xp>
			<sigma_y>0.0</sigma_y>
			<sigma_yp>0.0</sigma_yp>
		</source_size>
		<d_source_slit>1000.0</d_source_slit>
		<slit_size>
			<slit_size_x>0.001</slit_size_x>
			<slit_size_y>0.001</slit_size_y>
		</slit_size>
	</geometry>
	<excitation>
		<discrete>
			<energy>28.0</energy>
			<horizontal_intensity>2.9955e+12</horizontal_intensity>
			<vertical_intensity>4.5e+9</vertical_intensity>
		</discrete>
	</excitation>
	<absorbers>
		<detector_path>
			<layer>
				<element>
					<atomic_number>14</atomic_number>
					<weight_fraction>100.0</weight_fraction>
				</element>
				<density>2.33</density>
				<thickness>0.000010</thickness>
			</layer>
			<layer>
				<element>
					<atomic_number>4</atomic_number>
					<weight_fraction>100.0</weight_fraction>
				</element>
				<density>1.848</density>
				<thickness>0.00080</thickness>
			</layer>
		</detector_path>
	</absorbers>
	<detector><!-- watch units here...-->
		<detector_type>SiLi</detector_type>
		<gain>20.048138</gain>
		<zero>0.0</zero>
		<fano>0.12</fano>
		<noise>0.1</noise>
		<max_convolution_energy>35.0</max_convolution_energy>
		<crystal>
			<layer>
				<element>
					<atomic_number>14</atomic_number>
					<weight_fraction>100.0</weight_fraction>
				</element>
				<density>2.33</density>
				<thickness>0.5</thickness>
			</layer>
		</crystal>
	</detector>
</xmimsim>
